{
  "$schema": "https://yusuke-hayashi.com/.well-known/schemas/identity-manifest-v4.schema.json",
  "schemaVersion": 4,
  "releaseRevision": 8,
  "subject": {
    "name": "Yusuke Hayashi",
    "canonicalUrl": "https://yusuke-hayashi.com"
  },
  "validity": {
    "issuedAt": "2026-07-24T12:55:00.000Z",
    "expiresAt": "2027-07-13T00:00:00.000Z"
  },
  "identifiers": {
    "domains": [
      "yusuke-hayashi.com",
      "haya.company",
      "haya-inc.co.jp"
    ],
    "github": {
      "handle": "yhay81",
      "profile": "https://github.com/yhay81",
      "repository": "https://github.com/yhay81/profile"
    },
    "openpgp": {
      "fingerprint": "B22B98ABB2D503307AB6A3160718EFA6506BB669",
      "uri": "openpgp4fpr:b22b98abb2d503307ab6a3160718efa6506bb669",
      "keyUrl": "https://yusuke-hayashi.com/pgp-key.asc",
      "wkdEmail": "yusuke@haya.company"
    },
    "ethereum": {
      "chainId": 1,
      "address": "0x1C049D25D368bFD50c74df68c919a12aDc48C079",
      "ens": {
        "name": "yhay81.eth",
        "registrationExpiresAt": "2030-07-17T09:27:23.000Z",
        "contentHash": "ipfs://bafybeia7ayng6ol5j2e7uzqub4httj6mqbx2jel7zflwhfn7gaslzetwmu",
        "textRecords": {
          "com.github": "yhay81",
          "com.twitter": "yhay81",
          "com.linkedin": "yhay81",
          "url": "https://yusuke-hayashi.com",
          "avatar": "ipfs://bafybeia7ayng6ol5j2e7uzqub4httj6mqbx2jel7zflwhfn7gaslzetwmu/me.webp",
          "key.pgp": "openpgp4fpr:b22b98abb2d503307ab6a3160718efa6506bb669",
          "description": "Yusuke Hayashi - software engineer. OpenPGP: B22B98ABB2D503307AB6A3160718EFA6506BB669"
        }
      }
    },
    "nostr": {
      "npub": "npub1p7jz9mh4vnz3c939w2af2q8zfgsg57ykjgcrjtxnnhdlmy62d7tsp9zw8v",
      "hex": "0fa422eef564c51c162572ba9500e24a208a78969230392cd39ddbfd934a6f97",
      "nip05": "yusuke@yusuke-hayashi.com"
    },
    "bluesky": {
      "handle": "yusuke-hayashi.com",
      "did": "did:plc:vesjclqfso2eo4h2dhfj3vwo"
    }
  },
  "proofs": [
    {
      "id": "openpgp-key",
      "type": "OpenPGP public key",
      "url": "https://yusuke-hayashi.com/pgp-key.asc",
      "mediaType": "application/pgp-keys"
    },
    {
      "id": "openpgp-ethereum",
      "type": "OpenPGP clearsign",
      "url": "https://yusuke-hayashi.com/proofs/statement.txt.asc",
      "mediaType": "text/plain"
    },
    {
      "id": "ethereum-openpgp",
      "type": "EIP-191 personal_sign",
      "url": "https://yusuke-hayashi.com/proofs/eth-attestation.json",
      "mediaType": "application/json"
    },
    {
      "id": "security-txt",
      "type": "OpenPGP clearsign",
      "url": "https://yusuke-hayashi.com/.well-known/security.txt",
      "mediaType": "text/plain"
    },
    {
      "id": "identity-manifest-signature",
      "type": "OpenPGP detached signature",
      "url": "https://yusuke-hayashi.com/.well-known/identity.json.asc",
      "mediaType": "application/pgp-signature"
    },
    {
      "id": "keyoxide",
      "type": "Keyoxide profile",
      "url": "https://keyoxide.org/b22b98abb2d503307ab6a3160718efa6506bb669",
      "mediaType": "text/html"
    }
  ],
  "history": {
    "url": "https://yusuke-hayashi.com/.well-known/identity-history.json",
    "sha256": "849b5e4f68214cb224181039899d0abbc1944d033dd49bb0f1585a79418005de"
  },
  "verifier": {
    "url": "https://yusuke-hayashi.com/.well-known/verify-identity.mjs",
    "sha256": "917ccb4be4547b19d2485fd4d70ec442a9f9eba15f117314096d5b965c483186"
  },
  "thirdPartyAttestations": {
    "index": {
      "url": "https://yusuke-hayashi.com/.well-known/attestations/index.json",
      "sha256": "ae3d48cfb57f3ec24fec6bd362fd33697ecb6b2519aa7105b6cad12d4b836d82"
    },
    "policy": {
      "url": "https://yusuke-hayashi.com/.well-known/attestations/policy.json",
      "sha256": "490a4b751ed1fd47a363e1fabc7fe1a8e5df7ba9fb83bc2c4433ebc82b1bab4b"
    },
    "schema": "https://yusuke-hayashi.com/.well-known/schemas/third-party-attestation-v1.schema.json"
  }
}
